{
  "$schema": "https://json-schema.org/draft/2020-12/schema",
  "$id": "https://gitlab.com/gitlab-org/knowledge-graph/gkg-service",
  "title": "GraphQueryAsJSON",
  "description": "Schema for LLM-generated graph queries that compile to ClickHouse SQL",
  "type": "object",
  "required": ["query_type"],
  "properties": {
    "query_type": {
      "$ref": "#/$defs/QueryType"
    },
    "node": {
      "$ref": "#/$defs/NodeSelector",
      "description": "Single node for search queries"
    },
    "nodes": {
      "type": "array",
      "description": "Array of nodes for traversal, aggregation, path_finding queries",
      "minItems": 1,
      "items": {
        "$ref": "#/$defs/NodeSelector"
      }
    },
    "relationships": {
      "type": "array",
      "description": "Relationships between nodes to traverse",
      "default": [],
      "items": {
        "$ref": "#/$defs/RelationshipSelector"
      }
    },
    "aggregations": {
      "type": "array",
      "description": "Aggregation functions to apply. Required when query_type is 'aggregation'.",
      "default": [],
      "items": {
        "$ref": "#/$defs/Aggregation"
      }
    },
    "path": {
      "$ref": "#/$defs/PathConfig",
      "description": "Path finding configuration. Required when query_type is 'path_finding'."
    },
    "neighbors": {
      "$ref": "#/$defs/NeighborsConfig",
      "description": "Neighbors configuration. Required when query_type is 'neighbors'."
    },
    "limit": {
      "type": "integer",
      "description": "Maximum number of results to return. Mutually exclusive with range.",
      "minimum": 1,
      "maximum": 1000,
      "default": 30
    },
    "range": {
      "type": "object",
      "description": "Bounded result window for pagination. Mutually exclusive with limit. Size (end - start) capped at 1000 by the server.",
      "required": ["start", "end"],
      "properties": {
        "start": {
          "type": "integer",
          "description": "Index of the first row to return (0-based), applied after filtering and ordering",
          "minimum": 0
        },
        "end": {
          "type": "integer",
          "description": "Index of the last row to return (exclusive). end - start must not exceed 1000.",
          "minimum": 1
        }
      },
      "additionalProperties": false
    },
    "order_by": {
      "$ref": "#/$defs/OrderBy",
      "description": "Result ordering specification"
    },
    "aggregation_sort": {
      "$ref": "#/$defs/AggregationSort",
      "description": "Ordering for aggregation outputs"
    }
  },
  "allOf": [
    {
      "not": {
        "required": ["limit", "range"]
      }
    },
    {
      "if": {
        "properties": {
          "query_type": { "enum": ["search", "neighbors"] }
        }
      },
      "then": {
        "required": ["node"],
        "not": {
          "required": ["nodes"]
        }
      },
      "else": {
        "required": ["nodes"],
        "not": {
          "required": ["node"]
        }
      }
    },
    {
      "if": {
        "properties": {
          "query_type": { "const": "neighbors" }
        }
      },
      "then": {
        "required": ["neighbors"]
      }
    },
    {
      "if": {
        "properties": {
          "query_type": { "const": "aggregation" }
        }
      },
      "then": {
        "required": ["aggregations"],
        "properties": {
          "aggregations": {
            "minItems": 1
          },
          "nodes": {
            "minItems": 1,
            "description": "Aggregation requires at least 1 node"
          }
        }
      }
    },
    {
      "if": {
        "properties": {
          "query_type": { "const": "traversal" }
        }
      },
      "then": {
        "properties": {
          "nodes": {
            "minItems": 2,
            "description": "Traversal and pathfinding queries require at least 2 nodes"
          }
        }
      }
    },
    {
      "if": {
        "properties": {
          "query_type": { "const": "path_finding" }
        }
      },
      "then": {
        "required": ["path"],
        "properties": {
          "nodes": {
            "minItems": 2,
            "description": "Path finding requires at least 2 nodes (start and end)"
          }
        }
      }
    }
  ],
  "$defs": {
    "Identifier": {
      "type": "string",
      "description": "Safe SQL identifier: starts with letter/underscore, alphanumeric/underscore only, max 64 chars",
      "pattern": "^[a-zA-Z_][a-zA-Z0-9_]{0,63}$",
      "minLength": 1,
      "maxLength": 64
    },
    "QueryType": {
      "type": "string",
      "description": "Type of graph query to execute",
      "enum": ["traversal", "aggregation", "path_finding", "search", "neighbors"]
    },
    "EntityType": {
      "type": "string",
      "description": "Valid entity types corresponding to GitLab data types (e.g., User, Project, MergeRequest). Validated against ontology at runtime.",
      "minLength": 1
    },
    "NodeProperties": {
      "type": "object",
      "description": "Property definitions per node label. Populated dynamically from ontology. Keys are entity names, values describe available properties.",
      "additionalProperties": {
        "type": "object",
        "description": "Properties available for a specific node label. Keys are property names, values are property schemas.",
        "additionalProperties": {
          "type": "object",
          "description": "Schema for a single property",
          "properties": {
            "type": {
              "type": "string",
              "description": "JSON Schema type of the property",
              "enum": ["string", "integer", "number", "boolean", "array", "object", "null"]
            },
            "description": {
              "type": "string",
              "description": "Human-readable description of the property"
            },
            "format": {
              "type": "string",
              "description": "Optional format hint (e.g., 'date-time', 'email', 'uri')"
            },
            "items": {
              "type": "object",
              "description": "For array types, describes the items"
            }
          }
        }
      }
    },
    "NodeSelector": {
      "type": "object",
      "description": "Selector for matching nodes in the graph",
      "required": ["id", "entity"],
      "properties": {
        "id": {
          "$ref": "#/$defs/Identifier",
          "description": "Variable identifier for this node (e.g., 'i', 'mr', 'user'). Used to reference this node in relationships and aggregations."
        },
        "entity": {
          "$ref": "#/$defs/EntityType",
          "description": "Entity type (e.g., User, Project, MergeRequest). Determines which table to query."
        },
        "columns": {
          "$ref": "#/$defs/ColumnSelection",
          "description": "Columns to return for this node. Use '*' for all columns, or specify an array of column names. Mandatory columns (id, type) are always included for redaction."
        },
        "filters": {
          "type": "object",
          "description": "Property filters. Keys are property names, values are Filter objects.",
          "propertyNames": {
            "$ref": "#/$defs/Identifier"
          },
          "additionalProperties": {
            "$ref": "#/$defs/Filter"
          },
          "default": {}
        },
        "node_ids": {
          "type": "array",
          "description": "Specific node IDs to filter by",
          "items": {
            "type": "integer"
          },
          "minItems": 1
        },
        "id_range": {
          "$ref": "#/$defs/IdRange",
          "description": "ID range filter (inclusive)"
        },
        "id_property": {
          "$ref": "#/$defs/Identifier",
          "description": "Which property to use as ID (default: 'id')",
          "default": "id"
        }
      }
    },
    "ColumnSelection": {
      "description": "Column selection for a node. Use '*' for all columns or an array of specific column names.",
      "oneOf": [
        {
          "const": "*",
          "description": "Select all columns for this entity"
        },
        {
          "type": "array",
          "description": "List of specific column names to select",
          "items": {
            "$ref": "#/$defs/Identifier"
          },
          "minItems": 1
        }
      ]
    },
    "IdRange": {
      "type": "object",
      "description": "Inclusive ID range filter",
      "required": ["start", "end"],
      "properties": {
        "start": {
          "type": "integer",
          "description": "Start of ID range (inclusive)"
        },
        "end": {
          "type": "integer",
          "description": "End of ID range (inclusive)"
        }
      }
    },
    "Filter": {
      "description": "Property filter - supports both simple equality and advanced operators",
      "oneOf": [
        {
          "$ref": "#/$defs/FilterValue",
          "description": "Simple equality filter (backward compatible)"
        },
        {
          "$ref": "#/$defs/PropertyFilter",
          "description": "Advanced operator-based filter"
        }
      ]
    },
    "FilterValue": {
      "description": "A filter value - can be integer, string, boolean, or list",
      "oneOf": [
        {
          "type": "integer",
          "description": "Integer value"
        },
        {
          "type": "string",
          "description": "String value"
        },
        {
          "type": "boolean",
          "description": "Boolean value"
        },
        {
          "type": "array",
          "description": "List of values",
          "items": {
            "$ref": "#/$defs/FilterValue"
          }
        }
      ]
    },
    "PropertyFilter": {
      "type": "object",
      "description": "Advanced filter with operator",
      "required": ["op"],
      "properties": {
        "op": {
          "type": "string",
          "description": "Filter operator. is_null and is_not_null do not require a value; all others do.",
          "enum": ["eq", "gt", "lt", "gte", "lte", "in", "contains", "starts_with", "ends_with", "is_null", "is_not_null"]
        },
        "value": {
          "description": "Filter value. Required for all operators except is_null and is_not_null. Type depends on operator: array for 'in', string for contains/starts_with/ends_with, FilterValue for comparison operators."
        }
      },
      "allOf": [
        {
          "if": { "properties": { "op": { "enum": ["eq", "gt", "lt", "gte", "lte"] } } },
          "then": { "required": ["value"], "properties": { "value": { "$ref": "#/$defs/FilterValue" } } }
        },
        {
          "if": { "properties": { "op": { "const": "in" } } },
          "then": {
            "required": ["value"],
            "properties": {
              "value": {
                "type": "array",
                "items": { "$ref": "#/$defs/FilterValue" },
                "minItems": 1
              }
            }
          }
        },
        {
          "if": { "properties": { "op": { "enum": ["contains", "starts_with", "ends_with"] } } },
          "then": { "required": ["value"], "properties": { "value": { "type": "string" } } }
        }
      ]
    },
    "RelationshipSelector": {
      "type": "object",
      "description": "Selector for relationship traversal between nodes",
      "required": ["type", "from", "to"],
      "properties": {
        "type": {
          "$ref": "#/$defs/RelationshipType",
          "description": "Relationship type(s) to traverse"
        },
        "from": {
          "$ref": "#/$defs/Identifier",
          "description": "Source node variable ID (must match a node's id field)"
        },
        "to": {
          "$ref": "#/$defs/Identifier",
          "description": "Target node variable ID (must match a node's id field)"
        },
        "min_hops": {
          "type": "integer",
          "description": "Minimum number of relationship hops",
          "minimum": 0,
          "maximum": 3,
          "default": 1
        },
        "max_hops": {
          "type": "integer",
          "description": "Maximum number of relationship hops. SECURITY: Limited to 3 to prevent resource exhaustion.",
          "minimum": 1,
          "maximum": 3,
          "default": 1
        },
        "direction": {
          "$ref": "#/$defs/Direction",
          "description": "Direction to traverse the relationship",
          "default": "outgoing"
        },
        "filters": {
          "type": "object",
          "description": "Filters on relationship properties",
          "propertyNames": {
            "$ref": "#/$defs/Identifier"
          },
          "additionalProperties": {
            "$ref": "#/$defs/Filter"
          },
          "default": {}
        }
      },
      "allOf": [
        {
          "description": "max_hops must be >= min_hops",
          "if": { "required": ["min_hops"], "properties": { "min_hops": { "minimum": 2 } } },
          "then": { "properties": { "max_hops": { "minimum": 2 } } }
        },
        {
          "if": { "required": ["min_hops"], "properties": { "min_hops": { "minimum": 3 } } },
          "then": { "properties": { "max_hops": { "minimum": 3 } } }
        }
      ]
    },
    "RelationshipType": {
      "description": "Relationship type specification - single, multiple, or wildcard",
      "oneOf": [
        {
          "$ref": "#/$defs/RelationshipTypeName",
          "description": "Single relationship type"
        },
        {
          "type": "array",
          "description": "Multiple relationship types (UNION ALL)",
          "items": {
            "$ref": "#/$defs/RelationshipTypeName"
          },
          "minItems": 1
        }
      ]
    },
    "RelationshipTypeName": {
      "type": "string",
      "description": "Valid relationship type names. Validated against ontology at runtime.",
      "minLength": 1
    },
    "Direction": {
      "type": "string",
      "description": "Direction to traverse relationships. 'outgoing' follows from_table → to_table, 'incoming' reverses it.",
      "enum": ["outgoing", "incoming", "both"],
      "default": "outgoing"
    },
    "Aggregation": {
      "type": "object",
      "description": "Aggregation function specification",
      "required": ["function"],
      "properties": {
        "function": {
          "$ref": "#/$defs/AggFunction",
          "description": "Aggregation function to apply"
        },
        "target": {
          "$ref": "#/$defs/Identifier",
          "description": "Node variable to aggregate over. If omitted, aggregates all matching nodes."
        },
        "group_by": {
          "$ref": "#/$defs/Identifier",
          "description": "Node variable to group by. If omitted, no grouping is applied."
        },
        "property": {
          "$ref": "#/$defs/Identifier",
          "description": "Property to aggregate. Required for sum, avg, min, max functions."
        },
        "alias": {
          "$ref": "#/$defs/Identifier",
          "description": "Output column alias for the aggregation result"
        }
      },
      "if": {
        "properties": {
          "function": { "enum": ["sum", "avg", "min", "max"] }
        }
      },
      "then": {
        "required": ["property"]
      }
    },
    "AggFunction": {
      "type": "string",
      "description": "Available aggregation functions",
      "enum": ["count", "sum", "avg", "min", "max", "collect"]
    },
    "PathConfig": {
      "type": "object",
      "description": "Configuration for path finding queries",
      "required": ["type", "from", "to", "max_depth"],
      "properties": {
        "type": {
          "$ref": "#/$defs/PathType",
          "description": "Type of path finding algorithm"
        },
        "from": {
          "$ref": "#/$defs/Identifier",
          "description": "Source node variable ID"
        },
        "to": {
          "$ref": "#/$defs/Identifier",
          "description": "Target node variable ID"
        },
        "max_depth": {
          "type": "integer",
          "description": "Maximum path length (number of hops). SECURITY: Maximum 3 enforced.",
          "minimum": 1,
          "maximum": 3
        },
        "rel_types": {
          "type": "array",
          "description": "Optional: relationship types to traverse. If omitted, all types are considered.",
          "items": {
            "$ref": "#/$defs/RelationshipTypeName"
          }
        }
      }
    },
    "PathType": {
      "type": "string",
      "description": "Path finding algorithm type",
      "enum": ["shortest", "all_shortest", "any"]
    },
    "NeighborsConfig": {
      "type": "object",
      "description": "Configuration for neighbors queries",
      "required": ["node"],
      "properties": {
        "node": {
          "$ref": "#/$defs/Identifier",
          "description": "Node variable ID to find neighbors for"
        },
        "direction": {
          "$ref": "#/$defs/Direction",
          "description": "Direction to traverse relationships (outgoing, incoming, or both)",
          "default": "both"
        },
        "rel_types": {
          "type": "array",
          "description": "Optional: relationship types to traverse. If omitted, all types are considered.",
          "items": {
            "$ref": "#/$defs/RelationshipTypeName"
          },
          "default": []
        }
      }
    },
    "OrderBy": {
      "type": "object",
      "description": "Result ordering specification",
      "required": ["node", "property"],
      "properties": {
        "node": {
          "$ref": "#/$defs/Identifier",
          "description": "Node variable to order by"
        },
        "property": {
          "$ref": "#/$defs/Identifier",
          "description": "Property name to order by"
        },
        "direction": {
          "$ref": "#/$defs/OrderDirection",
          "description": "Sort direction",
          "default": "ASC"
        }
      }
    },
    "AggregationSort": {
      "type": "object",
      "description": "Ordering for aggregation outputs",
      "required": ["agg_index"],
      "properties": {
        "agg_index": {
          "type": "integer",
          "description": "Index of the aggregation in the aggregations array (0-based)",
          "minimum": 0
        },
        "direction": {
          "$ref": "#/$defs/OrderDirection",
          "description": "Sort direction",
          "default": "ASC"
        }
      }
    },
    "OrderDirection": {
      "type": "string",
      "description": "Sort direction",
      "enum": ["ASC", "DESC"],
      "default": "ASC"
    }
  }
}
