{
  "query_type": "traversal",
  "nodes": [
    {
      "id": "wi",
      "entity": "WorkItem",
      "filters": {
        "confidential": true,
        "state": "opened"
      }
    },
    {
      "id": "p",
      "entity": "Project"
    }
  ],
  "relationships": [
    {
      "type": "IN_PROJECT",
      "from": "wi",
      "to": "p"
    }
  ],
  "limit": 20
}