{
  "query_type": "search",
  "node": {
    "id": "u",
    "entity": "User",
    "filters": {
      "user_type": {
        "op": "in",
        "value": [
          "project_bot",
          "service_account",
          "automation_bot"
        ]
      }
    }
  },
  "limit": 30,
  "order_by": {
    "node": "u",
    "property": "created_at",
    "direction": "DESC"
  }
}