{
  "query_type": "traversal",
  "nodes": [
    {
      "id": "v",
      "entity": "Vulnerability",
      "filters": {
        "severity": "critical",
        "state": "detected"
      }
    },
    {
      "id": "p",
      "entity": "Project"
    }
  ],
  "relationships": [
    {
      "type": "IN_PROJECT",
      "from": "v",
      "to": "p"
    }
  ],
  "limit": 30,
  "order_by": {
    "node": "v",
    "property": "detected_at",
    "direction": "DESC"
  }
}