{
  "query_type": "traversal",
  "nodes": [
    {
      "id": "mr",
      "entity": "MergeRequest",
      "filters": {
        "state": "merged"
      }
    },
    {
      "id": "wi",
      "entity": "WorkItem"
    }
  ],
  "relationships": [
    {
      "type": "CLOSES",
      "from": "mr",
      "to": "wi"
    }
  ],
  "limit": 30
}