{
  "query_type": "traversal",
  "nodes": [
    {
      "id": "mr",
      "entity": "MergeRequest",
      "filters": {
        "state": "opened",
        "draft": true
      }
    },
    {
      "id": "author",
      "entity": "User"
    }
  ],
  "relationships": [
    {
      "type": "AUTHORED",
      "from": "author",
      "to": "mr"
    }
  ],
  "limit": 20
}